{
  "intent": "make_space",
  "constraints": [
    {"type": "lock", "item": "dresser"},
    {"type": "lock", "item": "bed"},
    {"type": "clear_zone", "w_m": 1.8, "d_m": 1.2, "label": "Yoga"}
  ],
  "variantName": "Yoga corner",
  "explanation": "Cleared a 1.8 × 1.2 m stretch of floor for your mat; the dresser and bed stayed put.",
  "preferences": ["does yoga every morning"]
}
